en,fr,it,de,es,ko,kana
"Raises one stat and lowers another.","Monte une stat tout en en baissant une autre.","Aumenta una statistica e ne riduce un’altra.","Erhöht einen Statuswert und senkt einen anderen.","Sube una característica mucho, pero baja otra.","능력이 오르락내리락한다.","のうりょくが　あがったり さがったりする。"
"Protects the Pokémon from things like sand, hail, and powder.","Protège du sable, de la grêle ou de la poudre.","Protegge il Pokémon da polvere, sabbia e grandine.","Nimmt keinen Schaden durch Wetterbedingungen.","Protege del polvo, la arena y el granizo.","먼지나 가루를 막는다.","ちりや　こなを ふせぐ。"
"May poison a target when the Pokémon makes contact.","Peut empoisonner l’ennemi par simple contact.","Può avvelenare il nemico al solo contatto fisico.","Kann das Ziel durch bloßes Berühren vergiften.","Puede envenenar al objetivo con solo tocarlo.","접촉하기만 해도 상대를 독 상태로 만들 때가 있다.","さわるだけで　あいてを どくにすることがある。"
"Restores a little HP when withdrawn from battle.","Restaure un peu de PV si le Pokémon est retiré.","Il Pokémon recupera un po’ di PS quando viene sostituito.","Heilt beim Austauschen eine geringe Menge an KP.","Recupera unos pocos PS al cambiar de Pokémon.","볼에 넣으면 HP가 조금 회복된다.","ひっこめると ＨＰが すこし　かいふくする。"
"Protects the Pokémon from Defense-lowering attacks.","Empêche les attaques adverses de baisser la Défense.","Evita che la Difesa diminuisca.","Hindert Angreifer daran, die Verteidigung zu senken.","Protege de los ataques que bajan la Defensa.","방어를 떨어뜨리는 공격을 받지 않는다.","ぼうぎょを　さげる こうげきを　うけない。"
"Boosts the Pokémon’s Speed stat in a sandstorm.","Augmente la Vitesse lors des tempêtes de sable.","La Velocità aumenta nelle tempeste di sabbia.","Erhöht in Sandstürmen die Initiative.","Aumenta la Velocidad durante las tormentas de arena.","모래바람으로 스피드가 올라간다.","すなあらしで すばやさが　あがる。"
"Makes status moves more likely to miss.","Résiste mieux aux attaques de statut.","Resiste più facilmente ai cambiamenti di stato.","Wehrt mit robustem Körper viele Status-Attacken ab.","Dificulta que le afecten los ataques de estado.","변화 기술을 받기 어려운 몸으로 되어 있다.","へんかわざを　うけにくい からだに　なっている。"
"Boosts move power when the Pokémon moves after the target.","Booste les capacités s’il attaque en dernier.","Se agisce per ultimo, la potenza della mossa sale.","Greift das Pokémon zuletzt an, ist es stärker.","Potencia el movimiento si es el último en atacar.","제일 마지막에 기술을 쓰면 강해진다.","いちばん　さいごに わざをだすと　つよくなる。"
"Comes out disguised as the Pokémon in the party’s last spot.","Prend l’apparence du dernier Pokémon de l’équipe.","Entra con le sembianze dell’ultimo Pokémon in squadra.","Bestreitet Kämpfe in der Gestalt des Listenletzten.","Se convierte en el último Pokémon del equipo.","뒤의 포켓몬으로 둔갑하여 나온다.","うしろの　ポケモンに なりきって　でてくる。"
"The Pokémon transforms itself into the Pokémon it’s facing.","Adopte l’apparence du Pokémon adverse.","Si trasforma nel Pokémon che ha davanti.","Kämpft als Kopie seines Gegenübers.","Se transforma en el Pokémon que tiene enfrente.","눈앞의 포켓몬으로 변신해버린다.","めのまえの　ポケモンに へんしん　してしまう。"
"Passes through the opposing Pokémon’s barrier and strikes.","Traverse les barrières de l’ennemi pour attaquer.","Attacca evitando le barriere del nemico.","Überwindet gegnerische Schilde und greift an.","Ataca rodeando la barrera del rival.","상대의 벽을 뚫고 공격한다.","あいての　かべを すりぬけて　こうげき。"
"Contact with the Pokémon spreads this Ability.","Momifie le talent de l’ennemi qui le touche.","L’abilità del nemico cambia in Mummia dopo il contatto.","Berührt man das Pokémon, übernimmt man seine Fähigkeit.","Contagia Momia al rival que lo toque.","상대의 기술을 받으면 상대를 미라로 만든다.","あいてに　さわられると あいてを　ミイラにする。"
"Boosts the Attack stat after knocking out any Pokémon.","Monte l’Attaque quand il met un ennemi K.O.","Aumenta l’Attacco quando manda un nemico KO.","Besiegt es ein Pokémon, steigt sein Angriffs-Wert.","Potencia el Ataque al debilitar a un objetivo.","상대를 쓰러뜨리면 공격이 올라간다.","あいてを　たおすと こうげきが　あがる。"
"Boosts the Attack stat when it’s hit by a Dark-type move.","Monte l’Attaque si une attaque Ténèbres le touche.","L’Attacco aumenta se si è colpiti da una mossa di tipo Buio.","Angriff steigt nach Einstecken einer Unlicht-Attacke.","Sube el Ataque al recibir uno de tipo Siniestro.","악 기술을 받으면 공격이 올라간다.","あくを　うけると こうげきが　あがる。"
"Some move types scare it and boost its Speed stat.","Sa peur de certains types augmente sa Vitesse.","Per paura di certi tipi di mosse, la Velocità sale.","Aus Angst vor manchen Attacken steigt die Initiative.","El miedo a algunos ataques sube su Velocidad.","주눅이 들어 스피드가 올라가는 타입이 있다.","びびって　すばやさが あがる　タイプがある。"
"Reflects status moves.","Renvoie les attaques de statut.","Riflette al mittente le mosse di stato.","Lenkt Status-Attacken auf den Angreifer um.","Permite devolver los ataques de estado.","변화 기술을 되받아칠 수 있다.","へんかわざを　かえす ことが　できる。"
"Boosts the Attack stat when hit by a Grass-type move.","Neutralise les attaques Plante et augmente l’Attaque.","Neutralizza le mosse di tipo Erba subite per aumentare l’Attacco.","Absorbiert Pflanzen-Attacken und steigert den Angriff.","Neutraliza los movimientos de tipo Planta y sube el Ataque.","풀 기술을 받으면 공격이 올라간다.","くさの　わざを　うけると こうげきが　あがる。"
"Gives priority to a status move.","Utilise les attaques de statut en premier.","Dà priorità a mosse che alterano lo stato.","Ermöglicht einen Erstschlag mit Status-Attacken.","Permite lanzar ataques de estado en primer lugar.","변화 기술을 먼저 쓸 수 있다.","へんかわざを　せんせいで だすことが　できる。"
"Boosts certain moves’ power in a sandstorm.","Renforce des capacités en cas de tempête de sable.","Potenzia alcune mosse nelle tempeste di sabbia.","Manche Attacken wirken in Sandstürmen besser.","Potencia algunos movimientos durante las tormentas de arena.","모래바람으로 위력이 올라가는 기술이 있다.","すなあらしで　いりょくが あがる　わざがある。"
"Inflicts damage to the attacker on contact.","Blesse l’attaquant au moindre contact.","Se chi attacca mette a segno una mossa fisica, viene danneggiato.","Angreifer nehmen durch bloßes Berühren Schaden.","Hiere al hacer contacto.","접촉한 상대에게 상처를 입힌다.","ふれた　あいてを キズつける。"
"Changes the Pokémon’s shape when HP is half or less.","Transforme le Pokémon dans les moments délicats.","Se il Pokémon è in difficoltà, ne cambia l’aspetto.","Wechselt seine Gestalt, wenn es eng wird.","Cambia de forma en un apuro.","위급할 때 모습이 변화한다.","ピンチに　なると すがたが　へんかする。"
"Boosts the accuracy of its allies and itself.","Monte la Précision des Pokémon de l’équipe.","Aumenta la precisione di chi la possiede e quella degli alleati.","Erhöht Genauigkeit bei allen Pokémon im Team.","Sube la Precisión de todo el equipo.","자신과 같은 편의 명중률이 올라간다.","じぶんや　みかたの めいちゅうが　あがる。"
"Moves can be used on the target regardless of its Abilities.","Les talents adverses ne bloquent pas ses capacités.","Neutralizza le abilità che bloccano le mosse.","Attacken können ungeachtet der Fähigkeit verwendet werden.","Usa movimientos sin que importen las habilidades.","특성에 관계없이 상대에게 기술을 쓸 수 있다.","とくせいに　かんけいなく あいてに　わざを　だせる。"
"Moves can be used on the target regardless of its Abilities.","Les talents adverses ne bloquent pas ses capacités.","Neutralizza le abilità che bloccano le mosse.","Attacken können ungeachtet der Fähigkeit verwendet werden.","Usa movimientos sin que importen las habilidades.","특성에 관계없이 상대에게 기술을 쓸 수 있다.","とくせいに　かんけいなく あいてに　わざを　だせる。"
"Protects allies from attacks that limit their move choices.","Protège l’équipe des attaques limitant le choix des capacités.","Protegge sé e gli alleati da mosse che limitano la scelta di attacchi.","Schützt alle Pokémon im Team vor manchen mentalen Angriffen.","Protege al equipo de ataques que impiden elegir movimientos.","같은 편으로 향하는 멘탈 공격을 막는다.","みかたへの　メンタル こうげきを　ふせぐ。"
"Prevents lowering of ally Grass-type Pokémon’s stats.","Empêche les alliés de type Plante de subir des diminutions de stats.","Evita il calo delle statistiche degli alleati di tipo Erba.","Schützt Pflanzen-Pokémon vor gesenkten Statuswerten.","Evita que bajen las características de Pokémon tipo Planta aliados.","같은 편의 풀타입 포켓몬은 능력이 떨어지지 않는다.","みかたの　くさポケモンは のうりょくが　さがらない。"
"Restores HP as well when the Pokémon eats a Berry.","Rend des PV lorsque le Pokémon consomme une Baie.","Fa recuperare PS quando il Pokémon mangia una bacca.","Heilt beim Konsum von Beeren KP.","Recupera PS al comer bayas.","나무열매를 먹으면 HP도 회복한다.","きのみを　たべると ＨＰも　かいふくする。"
"Changes the Pokémon’s type to the type of the move it’s using.","Le Pokémon prend le type de sa dernière capacité lancée.","Cambia il tipo del Pokémon in quello della mossa usata.","Das Pokémon nimmt bei Einsatz einer Attacke deren Typ an.","Cambia su tipo al del movimiento que acaba de usar.","사용한 기술과 같은 타입으로 변화한다.","だした　わざと　おなじ タイプに　へんかする。"
"Halves damage from physical moves.","Divise les dégâts des attaques physiques par deux.","Dimezza il danno degli attacchi fisici subiti.","Halbiert den Schaden durch physische Attacken.","Reduce a la mitad el daño recibido por ataques físicos.","물리 기술의 데미지가 절반이 된다.","ぶつりわざの　ダメージが はんぶんになる。"
"The Pokémon steals the held item of a Pokémon it hits with a move.","Les capacités volent aussi l’objet tenu par la cible.","Ruba lo strumento del Pokémon su cui è stata usata una mossa.","Stiehlt Items von Pokémon, die durch Attacken getroffen wurden.","Roba el objeto del Pokémon al que alcance con un movimiento.","기술을 맞은 상대의 도구를 빼앗아 버린다.","わざを　あてた　あいての どうぐを　うばってしまう。"
"Protects the Pokémon from some ball and bomb moves.","Protège de certaines capacités projetant des bombes, balles…","Protegge da alcune mosse a base di proiettili e bombe.","Schützt das Pokémon vor geworfenen Bomben und Kugeln.","No le afectan las bombas ni algunos proyectiles.","구슬이나 폭탄에 맞지 않는다.","たまや　ばくだんに あたらない。"
"Boosts the Sp. Atk stat when a stat is lowered.","Monte l’Attaque quand une stat est baissée par l’adversaire.","L’Attacco aumenta quando un nemico fa calare le statistiche.","Erhöht den Spezial-Angriff, wenn ein Statuswert gesenkt wurde.","Aumenta su At. Esp. cuando disminuyen otras características.","능력이 떨어지면 특수공격이 올라간다.","のうりょくが　さがると とくこうが　あがる。"
"The Pokémon’s strong jaw gives it tremendous biting power.","Grâce à une puissante mâchoire, les morsures sont plus fortes.","La robusta mascella del Pokémon permette morsi molto potenti.","Der kräftige Kiefer des Pokémon verleiht ihm einen starken Biss.","Su robusta mandíbula le confiere una potente mordedura.","턱이 튼튼하여 무는 힘이 강하다.","あごが　がんじょうで かむ　ちからが　つよい。"
"Normal-type moves become Ice-type moves.","Les capacités de type Normal deviennent de type Glace.","Le mosse di tipo Normale diventano di tipo Ghiaccio.","Attacken vom Typ Normal nehmen den Typ Eis an.","Convierte movimientos de tipo Normal en tipo Hielo.","노말타입의 기술이 얼음타입이 된다.","ノーマルタイプの　わざが こおりタイプになる。"
"Prevents itself and ally Pokémon from falling asleep.","Les Pokémon de l’équipe ne peuvent pas s’endormir.","Impedisce a sé e agli alleati di addormentarsi.","Alle Pokémon im Team können nicht einschlafen.","Evita que tu equipo Pokémon se duerma.","같은 편의 포켓몬이 잠들지 않게 된다.","みかたの　ポケモンは ねむらなくなる。"
"The Pokémon changes form depending on how it battles.","Change de forme selon la façon dont le Pokémon se bat.","L’aspetto del Pokémon cambia in base alla modalità di lotta.","Das Pokémon nimmt je nach Kampftaktik eine andere Form an.","Cambia de forma según su estilo de combate.","배틀모드에서 모습이 바뀐다.","せんとうモードで すがたが　かわる。"
"Gives priority to Flying-type moves.","Les attaques de type Vol sont prioritaires.","Dà priorità alle mosse di tipo Volante.","Ermöglicht es dem Pokémon, mit Flug-Attacken zuerst anzugreifen.","Da prioridad a los movimientos de tipo Volador.","비행타입의 기술이 먼저 나오게 된다.","ひこうタイプの　わざが せんせいで　だせる。"
"Powers up aura and pulse moves.","Augmente la puissance de certaines capacités de type aura.","Potenzia le mosse “pulsar” e altre come Ondasana.","Erhöht die Stärke einiger Wellen-, Aura- und Puls-Attacken.","Aumenta la potencia de algunos movimientos de pulsos y auras.","파동 기술의 위력이 크다.","はどうの　わざの いりょくが　たかい。"
"Boosts the Defense stat in Grassy Terrain.","Augmente la Défense si Champ Herbu est actif.","Aumenta la Difesa durante l’effetto di Campo Erboso.","Erhöht die Verteidigung, wenn Grasfeld aktiv ist.","Aumenta la Defensa mientras dura el efecto de Campo de Hierba.","그래스필드일 때 방어가 올라간다.","グラスフィールドのとき ぼうぎょが　あがる。"
"The Pokémon can pass an item to an ally.","Permet aux alliés d’utiliser l’objet porté par ce Pokémon.","Il Pokémon può passare il suo strumento a un alleato.","Das Pokémon kann sein Item an einen Mitstreiter weitergeben.","El Pokémon puede pasar su objeto a un aliado.","같은 편에게 도구를 건넬 수 있게 된다.","みかたに　どうぐを わたせるように　なる。"
"Powers up moves that make direct contact.","Augmente la puissance des attaques directes.","Potenzia le mosse che causano un contatto fisico.","Erhöht die Stärke von direkten Angriffen.","Aumenta la potencia de los movimientos de contacto directo.","접촉하는 기술의 위력이 올라간다.","せっしょくする　わざの いりょくが　あがる。"
"Normal-type moves become Fairy-type moves.","Les capacités de type Normal deviennent de type Fée.","Le mosse di tipo Normale diventano di tipo Folletto.","Attacken vom Typ Normal nehmen den Typ Fee an.","Convierte movimientos de tipo Normal en tipo Hada.","노말타입의 기술이 페어리타입이 된다.","ノーマルタイプの　わざが フェアリータイプになる。"
"Contact with the Pokémon lowers the attacker’s Speed stat.","Diminue la Vitesse de l’attaquant qui le touche.","Riduce la Velocità del Pokémon con cui entra in contatto.","Die Initiative von Angreifern sinkt durch bloßes Berühren.","Baja la Velocidad del Pokémon con el que entra en contacto.","접촉한 상대의 스피드를 떨어뜨린다.","ふれた　あいての すばやさを　さげる。"
"Normal-type moves become Flying-type moves.","Les capacités de type Normal deviennent de type Vol.","Le mosse di tipo Normale diventano di tipo Volante.","Attacken vom Typ Normal nehmen den Typ Flug an.","Convierte movimientos de tipo Normal en tipo Volador.","노말타입의 기술이 비행타입이 된다.","ノーマルタイプの　わざが ひこうタイプになる。"
"Parent and child attack together.","Attaque en famille.","Il Pokémon e il suo piccolo attaccano insieme.","Zwei Generationen setzen gemeinsam zum Angriff an.","Ataque en familia.","부모와 자식 2마리가 공격한다.","おやこ　２ひきで こうげきする。"
"Powers up each Pokémon’s Dark-type moves.","Renforce les attaques de type Ténèbres de tous les Pokémon.","Potenzia le mosse di tipo Buio di tutti i Pokémon.","Erhöht die Stärke von allen Attacken des Typs Unlicht.","Aumenta la potencia de todos los movimientos de tipo Siniestro.","전원의 악타입 기술이 강해진다.","ぜんいんの　あくタイプの わざが　つよくなる。"
"Powers up each Pokémon’s Fairy-type moves.","Renforce les attaques de type Fée de tous les Pokémon.","Potenzia le mosse di tipo Folletto di tutti i Pokémon.","Erhöht die Stärke von allen Attacken des Typs Fee.","Aumenta la potencia de todos los movimientos de tipo Hada.","전원의 페어리타입 기술이 강해진다.","ぜんいんの　フェアリー わざが　つよくなる。"
"The effects of “Aura” Abilities are reversed.","L’effet des auras est inversé.","Inverte gli effetti di tutte le aure.","Kehrt die Wirkung von Auren um.","Invierte los efectos que causan las auras.","오라의 효과가 반대가 된다.","オーラの　こうかが ぎゃくに　なる。"
