en,fr,it,de,es,ko,kana
"Prevents other Pokémon from lowering its stats.","Empêche les stats du Pokémon de baisser.","Le statistiche del Pokémon non possono essere ridotte.","Hindert Angreifer daran, Statuswerte zu senken.","Evita que bajen las características.","상대가 능력을 떨어뜨릴 수 없다.","あいてに　のうりょくを さげられない。"
"Boosts the Pokémon’s Attack stat.","Le Pokémon utilise sa maîtrise du yoga pour doubler la puissance de ses capacités physiques.","Migliora la statistica Attacco del Pokémon.","Stärkt physische Attacken.","Aumenta el Ataque.","물리공격의 위력이 올라간다.","ぶつり　こうげきの いりょくが　あがる。"
"Protects the Pokémon from critical hits.","Le Pokémon est protégé des coups critiques par sa carapace.","Evita che il Pokémon subisca brutti colpi.","Wehrt gegnerische Volltreffer ab.","Bloquea los golpes críticos.","상대의 공격이 급소에 맞지 않는다.","あいての　こうげきが きゅうしょに　あたらない。"
"Eliminates the effects of weather.","Annule les effets du climat.","Neutralizza gli effetti delle condizioni atmosferiche.","Hebt Wetter-Effekte auf.","Anula los efectos del tiempo atmosférico.","날씨의 영향이 없어진다.","てんきの　えいきょうが なくなる。"
"Raises evasion if the Pokémon is confused.","Augmente l'Esquive du Pokémon s'il est confus.","Aumenta l’elusione se il Pokémon è confuso.","Erhöht den Fluchtwert, wenn das Pokémon verwirrt ist.","Sube la Evasión si el Pokémon está confuso.","혼란에 빠져있으면 회피하기 쉬워진다.","こんらん　していると かいひ　しやすくなる。"
"Boosts the Speed stat when it’s hit by an Electric-type move.","Augmente la Vitesse si touché par une capacité Électrik.","Le mosse di tipo Elettro subite fanno aumentare la Velocità.","Erhöht nach einem Treffer durch eine Elektro-Attacke die Initiative.","Sube la Velocidad si le alcanza un ataque eléctrico.","전기를 받으면 스피드가 올라간다.","でんきを　うけると すばやさが　あがる。"
"Deals more damage to Pokémon of the same gender.","Devient plus fort si l’ennemi est du même sexe.","Rende più forti contro nemici dello stesso sesso.","Erhöht den Schaden, wenn das Ziel dasselbe Geschlecht hat.","Si el objetivo es del mismo sexo, inflige más daño.","상대와 성별이 같으면 강해진다.","あいてと　せいべつが おなじだと　つよくなる。"
"Boosts the Speed stat each time the Pokémon flinches.","Augmente la Vitesse du Pokémon quand il a peur.","Aumenta la Velocità se il Pokémon tentenna.","Erhöht die Initiative, sobald das Pokémon zurückschreckt.","Cada vez que retrocede sube su Velocidad.","풀죽을 때마다 스피드가 올라간다.","ひるむ　たびに すばやさが　あがる。"
"Boosts evasion in a hailstorm.","Augmente l’Esquive durant les tempêtes de grêle.","Aumenta l’elusione quando grandina.","Erhöht bei Hagel den Fluchtwert.","Sube la Evasión durante una tormenta de granizo.","날씨가 싸라기눈일 때 회피율이 올라간다.","てんきが　あられのとき かいひりつが　あがる。"
"Makes the Pokémon use a held Berry earlier than usual.","Permet d'utiliser plus rapidement une Baie tenue.","Favorisce l’uso anticipato di una bacca tenuta dal Pokémon.","Ermutigt zum frühzeitigen Einsatz von Beeren.","Fomenta el uso rápido de la baya que porte.","나무열매를 여느 때보다 빨리 사용한다.","きのみを　いつもより はやく　つかう。"
"Maxes the Attack stat after the Pokémon takes a critical hit.","Monte l’Attaque au max après avoir reçu un coup critique.","Massimizza l’Attacco se si subisce un brutto colpo.","Maximiert nach Einstecken eines Volltreffers den Angriffs-Wert.","Sube el Ataque al máximo tras un golpe crítico.","급소에 맞으면 공격이 올라간다.","きゅうしょに　うけると こうげきが　あがる。"
"Boosts the Speed stat if its held item is used or lost.","Augmente la Vitesse du Pokémon s'il perd ou utilise l'objet qu'il tenait au début du combat.","Aumenta la Velocità dopo aver usato o perso uno strumento.","Erhöht Initiative, wenn ein Item verwendet oder verloren wird.","Sube la Velocidad si usa o pierde el objeto que lleve.","도구가 없어지면 스피드가 올라간다.","どうぐが　なくなると すばやさが　あがる。"
"Weakens the power of Fire-type moves.","Réduit la puissance des capacités de type Feu.","Indebolisce l’effetto di mosse di tipo Fuoco.","Senkt die Stärke von Feuer-Attacken.","Atenúa los movimientos de tipo Fuego.","불꽃 기술의 위력을 약하게 한다.","ほのお　わざの いりょくを　よわめる。"
"The Pokémon is prone to wild stat changes.","Les variations de stats sont deux fois plus importantes pour le Pokémon.","Le statistiche possono cambiare senza preavviso.","Das Pokémon ist anfällig für Statusveränderungen.","Aumenta los cambios en las características.","능력 변화가 여느 때보다 심하다.","のうりょく　へんかが いつもより　はげしい。"
"Reduces HP if it’s hot. Water restores HP.","Perd des PV à la chaleur. L’eau les restaure.","Riduce i PS se fa caldo. In presenza di acqua, ridà PS.","Bei heißem Wetter verliert das Pokémon KP. Wasser heilt KP.","Pierde PS si hace calor. Los recupera con agua.","더우면 HP가 줄어든다. 물로 HP를 회복한다.","あついと　ＨＰが　へる。 みずで　ＨＰを　かいふく。"
"Adjusts power based on an opposing Pokémon’s stats.","Ajuste la puissance selon l’ennemi.","Regola la potenza in base al nemico.","Passt Kraft entsprechend den gegnerischen Statuswerten an.","Adapta su fuerza para cada rival.","상대의 능력을 보고 능력치를 바꾼다.","あいての　のうりょくを みて　つよさを　かえる。"
"Powers up punching moves.","Augmente la puissance des capacités coups de poing.","Potenzia le mosse che utilizzano pugni.","Steigert die Effektivität von Box- und Hieb-Attacken.","Aumenta la fuerza de los puñetazos.","펀치를 사용하는 기술의 위력이 올라간다.","パンチを　つかう　わざの いりょくが　あがる。"
"Restores HP if the Pokémon is poisoned.","Restaure des PV si le Pokémon est empoisonné.","Ridà PS se il Pokémon è avvelenato.","Heilt bei Vergiftungen KP.","Recupera PS si el Pokémon ha sido envenenado.","독 상태가 되면 HP를 회복한다.","どくじょうたいに　なると ＨＰを　かいふくする。"
"Powers up moves of the same type as the Pokémon.","Quand le Pokémon utilise une capacité du même type que lui, le bonus de puissance qu'elle reçoit est encore plus important que normalement.","Potenzia le mosse dello stesso tipo del Pokémon.","Erhöht die Stärke von Attacken desselben Typs.","Potencia los movimientos del mismo tipo del Pokémon.","타입이 같은 기술의 위력이 올라간다.","タイプが　おなじ　わざの いりょくが　あがる。"
"Increases the number of times multi-strike moves hit.","Augmente la fréquence des attaques multiples.","Aumenta la frequenza di mosse multicolpo.","Ermöglicht längere Trefferserien mit Serien-Attacken.","Aumenta la frecuencia de los movimientos múltiples.","연속 기술을 많이 쓸 수 있다.","れんぞく　わざを たくさん　だせる。"
"Heals status conditions if it’s raining.","Soigne les altérations de statut du Pokémon quand il pleut.","Cura i problemi di stato se piove.","Heilt bei Regen Statusprobleme.","Cura los problemas de estado si está lloviendo.","비가 오면 상태 이상이 회복된다.","じょうたい　いじょうが あめの　とき　なおる。"
"Boosts the Sp. Atk stat in sunny weather, but HP decreases.","Augmente l'Attaque Spéciale mais baisse les PV au soleil.","Se c’è il sole aumenta l’Attacco Speciale, ma riduce i PS.","Führt bei Sonne zu KP-Verlusten, erhöht aber den Spezial-Angriff.","Si hace sol, baja los PS, pero potencia el At. Esp.","맑으면 HP가 줄지만 특수공격이 올라간다.","はれると　ＨＰが　へるが とくこうが　あがる。"
"Boosts the Speed stat if the Pokémon has a status condition.","Augmente la Vitesse du Pokémon en cas d'altération de statut.","Aumenta la Velocità se c’è un problema di stato.","Erhöht bei Statusproblemen die Initiative.","Potencia la Velocidad si hay problemas de estado.","상태 이상이 되면 스피드가 올라간다.","じょうたい　いじょうで すばやさが　あがる。"
"All the Pokémon’s moves become Normal type.","Toutes les capacités sont de type Normal.","Le mosse del Pokémon diventano di tipo Normale.","Alle Attacken des Pokémon werden zu Normal-Attacken.","Todos los movimientos se vuelven de tipo Normal.","쓴 기술이 모두 노말타입이 된다.","だしたわざが　すべて ノーマルタイプに　なる。"
"Powers up moves if they become critical hits.","Augmente la puissance des coups critiques.","Aumenta i danni inflitti dai brutti colpi.","Steigert den Schaden von Volltreffern.","Potencia los movimientos si se vuelven críticos.","급소에 맞혔을 때 위력이 올라간다.","きゅうしょに　あてたとき いりょくが　あがる。"
"The Pokémon only takes damage from attacks.","Seule une attaque directe peut blesser le Pokémon.","Il Pokémon subisce danni solo da attacchi diretti.","Das Pokémon nimmt nur durch Offensiv-Attacken Schaden.","Solo dañan al Pokémon los ataques directos.","공격 이외에는 데미지를 입지 않는다.","こうげき　いがいでは ダメージを　うけない。"
"Ensures attacks by or against the Pokémon land.","Les capacités du Pokémon et de l'ennemi touchent à coup sûr.","Le mosse del Pokémon e del nemico vanno sempre a segno.","Alle Attacken des oder auf das Pokémon gelingen.","El movimiento del Pokémon y el del rival acertarán.","서로의 기술이 반드시 맞는다.","おたがいの　わざが かならず　あたる。"
"The Pokémon moves after all other Pokémon do.","Agit toujours après les autres Pokémon, même plus lents.","I nemici attaccano sempre per primi, anche se sono più lenti.","Handelt auch mit Initiative-Vorteil stets nach dem Gegner.","El Pokémon se mueve tras todos los demás.","상대보다 재빨라도 행동이 느려진다.","あいてより　すばやくても こうどうが　おそくなる。"
"Powers up the Pokémon’s weaker moves.","Augmente la puissance des capacités les plus faibles.","Potenzia le mosse più deboli del Pokémon.","Steigert die Effektivität von schwächeren Attacken.","Potencia los movimientos más débiles del Pokémon.","약한 기술의 위력이 올라간다.","よわい　わざの いりょくが　あがる。"
"Prevents status conditions in sunny weather.","Protège le Pokémon contre les altérations de statut quand le soleil brille.","Evita problemi di stato quando c’è il sole.","Verhindert bei Sonnenschein Statusprobleme.","Evita los problemas de estado si hace sol.","맑을 때는 상태 이상이 되지 않는다.","じょうたい　いじょうに はれのとき　ならない。"
"The Pokémon can’t use any held items.","Le Pokémon ne peut utiliser aucun objet tenu.","Il Pokémon non può usare lo strumento che ha.","Das Pokémon kann keine getragenen Items verwenden.","El Pokémon no puede usar objetos equipados.","지니고 있는 도구를 쓸 수 없다.","もっている　どうぐを つかうことが　できない。"
"Moves can be used on the target regardless of its Abilities.","Les talents adverses ne bloquent pas ses capacités.","Neutralizza le abilità che bloccano le mosse.","Attacken können ungeachtet der Fähigkeiten verwendet werden.","Usa movimientos sin que importen las habilidades del objetivo.","특성에 관계없이 상대에게 기술을 쓸 수 있다.","とくせいに　かんけいなく あいてに　わざを　だせる。"
"Boosts the critical-hit ratios of moves.","Le Pokémon est tellement chanceux qu'il inflige plus fréquemment des coups critiques.","Aumenta la probabilità di infliggere brutti colpi.","Erhöht die Wahrscheinlichkeit, einen Volltreffer zu landen.","Aumenta la probabilidad de dar golpes críticos.","상대의 급소에 공격이 맞기 쉽다.","あいての　きゅうしょに こうげきが　あたりやすい。"
"Damages the attacker landing the finishing hit.","Blesse l'attaquant qui porte le coup de grâce.","Arreca danni al Pokémon che sferra il colpo finale.","Fügt einem Angreifer, der das Pokémon besiegt, Schaden zu.","Daña al agresor que le ha dado el golpe de gracia.","기절할 때 스친 상대에게 데미지를 준다.","ひんしの　ときに　ふれた あいてに　ダメージ。"
"Senses an opposing Pokémon’s dangerous moves.","Le Pokémon devine si l'adversaire connaît une capacité dangereuse pour lui.","Rivela se il nemico ha mosse pericolose.","Ahnt gefährliche Attacken des Gegners voraus.","Prevé los movimientos peligrosos del rival.","상대가 지닌 위험한 기술을 감지한다.","あいての　もつ　きけんな わざを　さっちする。"
"Determines what moves an opposing Pokémon has.","Découvre la capacité ennemie la plus puissante.","Scopre la mossa più potente del nemico.","Gibt Auskunft über das Attacken- Repertoire des Gegners.","Determina el movimiento más potente del rival.","상대가 지닌 기술을 꿰뚫어볼 수 있다.","あいての　もつ　わざを よみとることが　できる。"
"Ignores the opposing Pokémon’s stat changes.","Ignore les changements de stats de l’ennemi.","Ignora le modifiche alle statistiche del nemico.","Ignoriert Statusveränderungen des Zieles.","No tiene en cuenta las mejoras en las características del rival.","상대의 능력 변화를 무시한다.","あいての　のうりょくの へんかを　むしする。"
"Powers up “not very effective” moves.","Améliore les capacités « pas très efficaces ».","Potenzia le mosse non molto efficaci.","Verstärkt nicht sehr effektive Attacken.","Potencia los movimientos que no son muy eficaces.","효과가 별로인 기술이 강해진다.","こうかいまひとつ　のとき わざを　つよめる。"
"Reduces damage from supereffective attacks.","Réduit les dégâts des capacités « super efficaces » subies.","Riduce la potenza delle mosse superefficaci.","Senkt die Stärke sehr effektiver Attacken.","Mitiga los movimientos supereficaces.","효과가 굉장한 기술의 위력을 약하게 한다.","こうかばつぐん　のとき いりょくを　よわめる。"
"Temporarily halves the Pokémon’s Attack and Speed stats.","Divise temporairement Vitesse et Attaque par 2.","Dimezza per un po’ l’Attacco e la Velocità.","Halbiert zeitweilig den Angriff und die Initiative.","Baja a la mitad el Ataque y la Velocidad durante un rato.","공격과 스피드가 잠시 동안 절반이 된다.","こうげきと　すばやさが しばらく　はんぶんになる。"
"Makes Normal- and Fighting-type moves hit Ghost-type Pokémon.","Les capacités Normal et Combat touchent les Pokémon Spectre.","I Pokémon di tipo Spettro sono colpiti da mosse Normale e Lotta.","Normal- und Kampf-Attacken treffen Pokémon vom Typ Geist.","Movimientos tipo Normal y Lucha golpean a Pokémon Fantasma.","고스트타입에 노말 기술이 맞는다.","ゴーストタイプに ノーマルわざが　あたる。"
"Draws in all Water-type moves to boost its Sp. Atk stat.","Attire et neutralise les attaques Eau, et monte l'Attaque Spéciale.","Neutralizza mosse di tipo Acqua per aumentare l’Attacco Speciale.","Absorbiert Wasser-Attacken und steigert den Spezial-Angriff.","Atrae y neutraliza los movimientos de tipo Agua y sube el At. Esp.","물을 끌어모아 특수공격을 올린다.","みずを　よびこんで とくこうを　あげる。"
"The Pokémon gradually regains HP in a hailstorm.","Régénère ses PV lors des tempêtes de grêle.","Il Pokémon recupera PS quando grandina.","Regeneriert bei Hagel nach und nach KP.","Recupera algunos PS cuando hay tormentas de granizo.","싸라기눈일 때 HP를 조금씩 회복한다.","あられのとき　HPを すこしずつ　かいふく。"
"Reduces damage from supereffective attacks.","Réduit les dégâts des capacités « super efficaces » subies.","Riduce la potenza delle mosse superefficaci.","Senkt die Stärke sehr effektiver Attacken.","Mitiga los movimientos supereficaces.","효과가 굉장한 기술의 위력을 약하게 한다.","こうかばつぐん　のとき いりょくを　よわめる。"
"The Pokémon summons a hailstorm when it enters a battle.","Déclenche une tempête de grêle pendant le combat.","Il Pokémon provoca una grandinata durante la lotta.","Das Pokémon beschwört im Kampf Hagelstürme herauf.","El Pokémon invoca una tormenta de granizo.","배틀에 나가면 싸라기눈을 내리게 한다.","せんとうに　でると あられを　ふらす。"
"The Pokémon may gather Honey from somewhere.","Le Pokémon peut parfois trouver du Miel après un combat.","Il Pokémon può raccogliere Miele.","Das Pokémon sammelt gelegentlich Honig auf.","El Pokémon recoge Miel de donde puede.","달콤한꿀을 모아서 올 때가 있다.","あまいミツを　あつめて くることが　ある。"
"The Pokémon can check an opposing Pokémon’s held item.","Permet de connaître l'objet tenu par l'ennemi quand le combat commence.","Il Pokémon scopre che strumento ha il nemico.","Gibt Auskunft über gegnerische Items.","El Pokémon puede ver el objeto que lleva el rival.","상대가 지닌 물건을 알 수 있다.","あいての　もちものを しることが　できる。"
"Powers up moves that have recoil damage.","Booste les capacités ayant des dégâts de contrecoups.","Potenzia le mosse che provocano contraccolpi.","Verstärkt Attacken mit Rückstoß-Schaden.","Potencia los movimientos que dañan al usuario.","반동 데미지를 받는 기술이 강해진다.","はんどうで　ダメージを うけるわざが　つよくなる。"
"Changes the Pokémon’s type to match the Plate it holds.","Modifie le type en fonction de la Plaque tenue.","Cambia il tipo del Pokémon a seconda della lastra che ha.","Passt seinen Typ der getragenen Tafel an.","Cambia el tipo al de la tabla que lleve.","지니고 있는 플레이트에 따라 타입이 바뀐다.","もっている　プレートで タイプが　かわる。"
"Powers up party Pokémon when it is sunny.","Rend les Pokémon de l'équipe plus puissants au soleil.","Se c’è il sole, potenzia i Pokémon alleati.","Steigert bei Sonne die Effektivität von allen Team-Pokémon.","Potencia los Pokémon del equipo si está soleado.","맑을 때 자신과 같은 편이 강해진다.","はれのとき　じぶんと みかたが　つよくなる。"
"Reduces the HP of sleeping opposing Pokémon.","Réduit les PV d’un ennemi endormi.","Riduce i PS dei nemici addormentati.","Senkt die KP eines schlafenden Gegners.","Reduce los PS de cualquier rival que esté dormido.","잠들어 있는 상대의 HP를 줄인다.","ねむっている　あいての ＨＰを　へらす。"
"Steals an item from an attacker that made direct contact.","Vole l’objet de l’attaquant si son attaque touche.","Al contatto subito, ruba lo strumento di chi lo ha attaccato.","Stiehlt Angreifern Items, wenn es von ihnen berührt wird.","Al ser golpeado, roba el objeto del objetivo.","닿은 상대로부터 도구를 훔친다.","さわられた　あいてから どうぐを　ぬすむ。"
"Removes additional effects to increase move damage.","Frappe plus fort mais annule les effets cumulés.","Aumenta i danni annullando altri effetti delle mosse.","Bewirkt einen Kraftschub, aber hebt Zusatz-Effekte auf.","Sube la potencia y anula los efectos secundarios.","힘이 강해지지만 추가 효과가 없어진다.","ちからが　つよくなるが ついかこうかが　なくなる。"
"Makes stat changes have an opposite effect.","Inverse les variations de stats.","Le modifiche alle statistiche hanno effetto inverso.","Statusveränderungen werden umgekehrt.","Invierte los cambios en las características.","능력의 변화가 역전된다.","のうりょくの　へんかが ぎゃくてんする。"
"Unnerves opposing Pokémon and makes them unable to eat Berries.","L’ennemi stresse et ne peut plus manger de Baies.","Il nemico viene intimidito e non può mangiare bacche.","Hindert den Gegner durch Stress am Beerenkonsum.","Pone nervioso al rival y le impide usar bayas.","상대를 긴장시켜 나무열매를 먹지 못하게 한다.","あいてを　きんちょうさせ きのみを　たべさせない。"
"Boosts the Pokémon’s Attack stat when its stats are lowered.","Monte l’Attaque quand une stat est baissée par l’adversaire.","L’Attacco aumenta quando un nemico fa calare le statistiche.","Senkt der Gegner die Status- werte, steigt der Angriffs-Wert.","Sube el Ataque cuando el rival le baja las características.","능력이 떨어지면 공격이 올라간다.","のうりょくが　さがると こうげきが　あがる。"
"Lowers stats when HP becomes half or less.","Baisse les stats quand les PV tombent à la moitié.","Le statistiche scendono se i PS calano a metà o meno.","Bei halbierter KP-Anzahl sinken die Statuswerte.","Baja las características al llegar a la mitad los PS.","HP가 절반이 되면 능력이 떨어진다.","ＨＰが　はんぶんになると のうりょくが　さがる。"
"May disable a move used on the Pokémon.","Peut empêcher l’ennemi de réutiliser une attaque.","A volte inibisce l’ultima mossa usata dal nemico.","Blockiert gelegentlich Attacken.","Puede anular el movimiento usado en su contra.","공격받으면 가끔 상대를 사슬묶기 상태로 만든다.","こうげきされると　たまに かなしばりにする。"
"Sometimes heals an ally’s status condition.","Guérit parfois le statut des alliés alentour.","A volte cura i problemi di stato degli alleati.","Befreit Mitstreiter gelegentlich von Statusproblemen.","A veces cura los cambios de estado de un aliado.","같은 편의 상태 이상을 가끔 회복시킨다.","じょうたい　いじょうの みかたを　たまに　なおす。"
"Reduces damage done to allies.","Diminue les dégâts subis par les alliés.","Riduce il danno subito dagli alleati.","Verringert den Schaden an Mitstreitern.","Reduce el daño que sufren los aliados.","같은 편의 데미지를 줄일 수 있다.","みかたの　ダメージを へらすことができる。"
"Physical attacks lower its Defense stat and raise its Speed stat.","Un coup physique baisse la Défense, monte la Vitesse.","Riduce la Difesa e aumenta la Velocità se il Pokémon è colpito.","Phys. Treffer senken Verteidigung und steigern Initiative.","Un ataque físico baja la Defensa y sube la Velocidad.","물리 기술을 받으면 방어가 떨어지고 스피드가 올라간다.","ぶつりわざで　ぼうぎょが さがり　すばやさがあがる。"
"Doubles the Pokémon’s weight.","Double le poids du Pokémon.","Raddoppia il peso del Pokémon.","Verdoppelt das eigene Gewicht.","Duplica el peso del Pokémon.","자신의 무게가 2배가 된다.","じぶんの　おもさが ２ばいに　なる。"
"Halves the Pokémon’s weight.","Divise par 2 le poids du Pokémon.","Dimezza il peso del Pokémon.","Halbiert das eigene Gewicht.","Reduce a la mitad el peso del Pokémon.","자신의 무게가 절반이 된다.","じぶんの　おもさが はんぶんに　なる。"
"Reduces damage the Pokémon takes when its HP is full.","Reçoit moins de dégâts si les PV sont au maximum.","Riduce il danno subito se i PS sono al massimo.","Verringert den erlittenen Schaden bei vollen KP.","Reduce el daño sufrido si los PS están al máximo.","HP가 꽉 찼을 때 데미지가 줄어든다.","ＨＰが　まんたんのときに ダメージが　すくなくなる。"
"Powers up physical attacks when the Pokémon is poisoned.","Booste les attaques physiques si le statut est poison.","Aumenta l’Attacco se il Pokémon è avvelenato.","Erhöht bei Vergiftung die Stärke von physischen Attacken.","Aumenta la potencia física si está envenenado.","독 상태일 때 물리공격의 위력이 올라간다.","どくのとき　ぶつりの いりょくが　あがる。"
"Powers up special attacks when the Pokémon is burned.","Booste les attaques spéciales si le statut est brûlure.","Aumenta l’Attacco Speciale se il Pokémon è scottato.","Verstärkt bei Verbrennungen die Stärke von Spezial-Attacken.","Potencia los ataques especiales cuando el Pokémon se quema.","화상 상태일 때 특수공격의 위력이 올라간다.","やけどのとき　とくしゅの いりょくが　あがる。"
"May create another Berry after one is used.","Les Baies utilisées peuvent repousser.","Può ricreare una bacca utilizzata.","Aufgebrauchte Beeren können mehrmals nachwachsen.","Permite reutilizar varias veces una misma baya.","사용한 나무열매를 몇 번이고 만들어 낸다.","つかった　きのみを なんかいも　つくりだす。"
"Anticipates an ally’s attack and dodges it.","Anticipe et évite les attaques de ses alliés.","Prevede ed evita gli attacchi degli alleati.","Erkennt und pariert Attacken von Mitstreitern.","Elude los ataques de aliados en batalla.","같은 편의 공격의 낌새를 읽고 기술을 받지 않는다.","みかたの　こうげきを よみとって　うけない。"
