en,fr,it,de,es,ko,kana
"Looses a powerful blast of light that cuts accuracy.","Looses a powerful blast of light that cuts accuracy.","Looses a powerful blast of light that cuts accuracy.","Looses a powerful blast of light that cuts accuracy.","Looses a powerful blast of light that cuts accuracy.","Looses a powerful blast of light that cuts accuracy.","Looses a powerful blast of light that cuts accuracy."
"Attacks with a psychic wave of varying intensity.","Attacks with a psychic wave of varying intensity.","Attacks with a psychic wave of varying intensity.","Attacks with a psychic wave of varying intensity.","Attacks with a psychic wave of varying intensity.","Attacks with a psychic wave of varying intensity.","Attacks with a psychic wave of varying intensity."
"It’s just a splash... Has no effect whatsoever.","It’s just a splash... Has no effect whatsoever.","It’s just a splash... Has no effect whatsoever.","It’s just a splash... Has no effect whatsoever.","It’s just a splash... Has no effect whatsoever.","It’s just a splash... Has no effect whatsoever.","It’s just a splash... Has no effect whatsoever."
"Liquifies the user’s body to sharply raise DEFENSE.","Liquifies the user’s body to sharply raise DEFENSE.","Liquifies the user’s body to sharply raise DEFENSE.","Liquifies the user’s body to sharply raise DEFENSE.","Liquifies the user’s body to sharply raise DEFENSE.","Liquifies the user’s body to sharply raise DEFENSE.","Liquifies the user’s body to sharply raise DEFENSE."
"Hammers with a pincer. Has a high critical-hit ratio.","Hammers with a pincer. Has a high critical-hit ratio.","Hammers with a pincer. Has a high critical-hit ratio.","Hammers with a pincer. Has a high critical-hit ratio.","Hammers with a pincer. Has a high critical-hit ratio.","Hammers with a pincer. Has a high critical-hit ratio.","Hammers with a pincer. Has a high critical-hit ratio."
"Inflicts severe damage but makes the user faint.","Inflicts severe damage but makes the user faint.","Inflicts severe damage but makes the user faint.","Inflicts severe damage but makes the user faint.","Inflicts severe damage but makes the user faint.","Inflicts severe damage but makes the user faint.","Inflicts severe damage but makes the user faint."
"Rakes the foe with sharp claws, etc., 2 to 5 times.","Rakes the foe with sharp claws, etc., 2 to 5 times.","Rakes the foe with sharp claws, etc., 2 to 5 times.","Rakes the foe with sharp claws, etc., 2 to 5 times.","Rakes the foe with sharp claws, etc., 2 to 5 times.","Rakes the foe with sharp claws, etc., 2 to 5 times.","Rakes the foe with sharp claws, etc., 2 to 5 times."
"Throws a bone boomerang that strikes twice.","Throws a bone boomerang that strikes twice.","Throws a bone boomerang that strikes twice.","Throws a bone boomerang that strikes twice.","Throws a bone boomerang that strikes twice.","Throws a bone boomerang that strikes twice.","Throws a bone boomerang that strikes twice."
"The user sleeps for 2 turns, restoring HP and status.","The user sleeps for 2 turns, restoring HP and status.","The user sleeps for 2 turns, restoring HP and status.","The user sleeps for 2 turns, restoring HP and status.","The user sleeps for 2 turns, restoring HP and status.","The user sleeps for 2 turns, restoring HP and status.","The user sleeps for 2 turns, restoring HP and status."
"Large boulders are hurled. May cause flinching.","Large boulders are hurled. May cause flinching.","Large boulders are hurled. May cause flinching.","Large boulders are hurled. May cause flinching.","Large boulders are hurled. May cause flinching.","Large boulders are hurled. May cause flinching.","Large boulders are hurled. May cause flinching."
"Attacks with sharp fangs. May cause flinching.","Attacks with sharp fangs. May cause flinching.","Attacks with sharp fangs. May cause flinching.","Attacks with sharp fangs. May cause flinching.","Attacks with sharp fangs. May cause flinching.","Attacks with sharp fangs. May cause flinching.","Attacks with sharp fangs. May cause flinching."
"Reduces the polygon count and raises ATTACK.","Reduces the polygon count and raises ATTACK.","Reduces the polygon count and raises ATTACK.","Reduces the polygon count and raises ATTACK.","Reduces the polygon count and raises ATTACK.","Reduces the polygon count and raises ATTACK.","Reduces the polygon count and raises ATTACK."
"Changes the user’s type into an own move’s type.","Changes the user’s type into an own move’s type.","Changes the user’s type into an own move’s type.","Changes the user’s type into an own move’s type.","Changes the user’s type into an own move’s type.","Changes the user’s type into an own move’s type.","Changes the user’s type into an own move’s type."
"Fires three types of beams at the same time.","Fires three types of beams at the same time.","Fires three types of beams at the same time.","Fires three types of beams at the same time.","Fires three types of beams at the same time.","Fires three types of beams at the same time.","Fires three types of beams at the same time."
"Attacks with sharp fangs and cuts half the foe’s HP.","Attacks with sharp fangs and cuts half the foe’s HP.","Attacks with sharp fangs and cuts half the foe’s HP.","Attacks with sharp fangs and cuts half the foe’s HP.","Attacks with sharp fangs and cuts half the foe’s HP.","Attacks with sharp fangs and cuts half the foe’s HP.","Attacks with sharp fangs and cuts half the foe’s HP."
"Slashes with claws, etc. Has a high critical-hit ratio.","Slashes with claws, etc. Has a high critical-hit ratio.","Slashes with claws, etc. Has a high critical-hit ratio.","Slashes with claws, etc. Has a high critical-hit ratio.","Slashes with claws, etc. Has a high critical-hit ratio.","Slashes with claws, etc. Has a high critical-hit ratio.","Slashes with claws, etc. Has a high critical-hit ratio."
"Creates a decoy using 1/4 of the user’s maximum HP.","Creates a decoy using 1/4 of the user’s maximum HP.","Creates a decoy using 1/4 of the user’s maximum HP.","Creates a decoy using 1/4 of the user’s maximum HP.","Creates a decoy using 1/4 of the user’s maximum HP.","Creates a decoy using 1/4 of the user’s maximum HP.","Creates a decoy using 1/4 of the user’s maximum HP."
"Used only if all PP are gone. Also hurts the user a little.","Used only if all PP are gone. Also hurts the user a little.","Used only if all PP are gone. Also hurts the user a little.","Used only if all PP are gone. Also hurts the user a little.","Used only if all PP are gone. Also hurts the user a little.","Used only if all PP are gone. Also hurts the user a little.","Used only if all PP are gone. Also hurts the user a little."
"Copies the foe’s last move permanently.","Copies the foe’s last move permanently.","Copies the foe’s last move permanently.","Copies the foe’s last move permanently.","Copies the foe’s last move permanently.","Copies the foe’s last move permanently.","Copies the foe’s last move permanently."
"Kicks the foe 3 times in a row with rising intensity.","Kicks the foe 3 times in a row with rising intensity.","Kicks the foe 3 times in a row with rising intensity.","Kicks the foe 3 times in a row with rising intensity.","Kicks the foe 3 times in a row with rising intensity.","Kicks the foe 3 times in a row with rising intensity.","Kicks the foe 3 times in a row with rising intensity."
"While attacking, it may steal the foe’s held item.","While attacking, it may steal the foe’s held item.","While attacking, it may steal the foe’s held item.","While attacking, it may steal the foe’s held item.","While attacking, it may steal the foe’s held item.","While attacking, it may steal the foe’s held item.","While attacking, it may steal the foe’s held item."
"Ensnares the foe to stop it from fleeing or switching.","Ensnares the foe to stop it from fleeing or switching.","Ensnares the foe to stop it from fleeing or switching.","Ensnares the foe to stop it from fleeing or switching.","Ensnares the foe to stop it from fleeing or switching.","Ensnares the foe to stop it from fleeing or switching.","Ensnares the foe to stop it from fleeing or switching."
"Senses the foe’s action to ensure the next move’s hit.","Senses the foe’s action to ensure the next move’s hit.","Senses the foe’s action to ensure the next move’s hit.","Senses the foe’s action to ensure the next move’s hit.","Senses the foe’s action to ensure the next move’s hit.","Senses the foe’s action to ensure the next move’s hit.","Senses the foe’s action to ensure the next move’s hit."
"Inflicts 1/4 damage on a sleeping foe every turn.","Inflicts 1/4 damage on a sleeping foe every turn.","Inflicts 1/4 damage on a sleeping foe every turn.","Inflicts 1/4 damage on a sleeping foe every turn.","Inflicts 1/4 damage on a sleeping foe every turn.","Inflicts 1/4 damage on a sleeping foe every turn.","Inflicts 1/4 damage on a sleeping foe every turn."
"A fiery charge attack that may inflict a burn.","A fiery charge attack that may inflict a burn.","A fiery charge attack that may inflict a burn.","A fiery charge attack that may inflict a burn.","A fiery charge attack that may inflict a burn.","A fiery charge attack that may inflict a burn.","A fiery charge attack that may inflict a burn."
"A loud attack that can be used only while asleep.","A loud attack that can be used only while asleep.","A loud attack that can be used only while asleep.","A loud attack that can be used only while asleep.","A loud attack that can be used only while asleep.","A loud attack that can be used only while asleep.","A loud attack that can be used only while asleep."
"A move that functions differently for GHOSTS.","A move that functions differently for GHOSTS.","A move that functions differently for GHOSTS.","A move that functions differently for GHOSTS.","A move that functions differently for GHOSTS.","A move that functions differently for GHOSTS.","A move that functions differently for GHOSTS."
"Inflicts more damage when the user’s HP is down.","Inflicts more damage when the user’s HP is down.","Inflicts more damage when the user’s HP is down.","Inflicts more damage when the user’s HP is down.","Inflicts more damage when the user’s HP is down.","Inflicts more damage when the user’s HP is down.","Inflicts more damage when the user’s HP is down."
"Makes the user resistant to the last attack’s type.","Makes the user resistant to the last attack’s type.","Makes the user resistant to the last attack’s type.","Makes the user resistant to the last attack’s type.","Makes the user resistant to the last attack’s type.","Makes the user resistant to the last attack’s type.","Makes the user resistant to the last attack’s type."
"Launches a vacuumed blast. High critical-hit ratio.","Launches a vacuumed blast. High critical-hit ratio.","Launches a vacuumed blast. High critical-hit ratio.","Launches a vacuumed blast. High critical-hit ratio.","Launches a vacuumed blast. High critical-hit ratio.","Launches a vacuumed blast. High critical-hit ratio.","Launches a vacuumed blast. High critical-hit ratio."
"Spores cling to the foe, sharply reducing SPEED.","Spores cling to the foe, sharply reducing SPEED.","Spores cling to the foe, sharply reducing SPEED.","Spores cling to the foe, sharply reducing SPEED.","Spores cling to the foe, sharply reducing SPEED.","Spores cling to the foe, sharply reducing SPEED.","Spores cling to the foe, sharply reducing SPEED."
"Inflicts more damage when the user’s HP is down.","Inflicts more damage when the user’s HP is down.","Inflicts more damage when the user’s HP is down.","Inflicts more damage when the user’s HP is down.","Inflicts more damage when the user’s HP is down.","Inflicts more damage when the user’s HP is down.","Inflicts more damage when the user’s HP is down."
"Spitefully cuts the PP of the foe’s last move.","Spitefully cuts the PP of the foe’s last move.","Spitefully cuts the PP of the foe’s last move.","Spitefully cuts the PP of the foe’s last move.","Spitefully cuts the PP of the foe’s last move.","Spitefully cuts the PP of the foe’s last move.","Spitefully cuts the PP of the foe’s last move."
"Blasts the foe with a snowy gust. May cause freezing.","Blasts the foe with a snowy gust. May cause freezing.","Blasts the foe with a snowy gust. May cause freezing.","Blasts the foe with a snowy gust. May cause freezing.","Blasts the foe with a snowy gust. May cause freezing.","Blasts the foe with a snowy gust. May cause freezing.","Blasts the foe with a snowy gust. May cause freezing."
"Evades attack, but may fail if used in succession.","Evades attack, but may fail if used in succession.","Evades attack, but may fail if used in succession.","Evades attack, but may fail if used in succession.","Evades attack, but may fail if used in succession.","Evades attack, but may fail if used in succession.","Evades attack, but may fail if used in succession."
"A punch is thrown at wicked speed to strike first.","A punch is thrown at wicked speed to strike first.","A punch is thrown at wicked speed to strike first.","A punch is thrown at wicked speed to strike first.","A punch is thrown at wicked speed to strike first.","A punch is thrown at wicked speed to strike first.","A punch is thrown at wicked speed to strike first."
"Frightens with a scary face to sharply reduce SPEED.","Frightens with a scary face to sharply reduce SPEED.","Frightens with a scary face to sharply reduce SPEED.","Frightens with a scary face to sharply reduce SPEED.","Frightens with a scary face to sharply reduce SPEED.","Frightens with a scary face to sharply reduce SPEED.","Frightens with a scary face to sharply reduce SPEED."
"Draws the foe close, then strikes without fail.","Draws the foe close, then strikes without fail.","Draws the foe close, then strikes without fail.","Draws the foe close, then strikes without fail.","Draws the foe close, then strikes without fail.","Draws the foe close, then strikes without fail.","Draws the foe close, then strikes without fail."
"Demands a kiss with a cute look. May cause confusion.","Demands a kiss with a cute look. May cause confusion.","Demands a kiss with a cute look. May cause confusion.","Demands a kiss with a cute look. May cause confusion.","Demands a kiss with a cute look. May cause confusion.","Demands a kiss with a cute look. May cause confusion.","Demands a kiss with a cute look. May cause confusion."
"Maximizes ATTACK while sacrificing HP.","Maximizes ATTACK while sacrificing HP.","Maximizes ATTACK while sacrificing HP.","Maximizes ATTACK while sacrificing HP.","Maximizes ATTACK while sacrificing HP.","Maximizes ATTACK while sacrificing HP.","Maximizes ATTACK while sacrificing HP."
"Sludge is hurled to inflict damage. May also poison.","Sludge is hurled to inflict damage. May also poison.","Sludge is hurled to inflict damage. May also poison.","Sludge is hurled to inflict damage. May also poison.","Sludge is hurled to inflict damage. May also poison.","Sludge is hurled to inflict damage. May also poison.","Sludge is hurled to inflict damage. May also poison."
"Hurls mud in the foe’s face to reduce its accuracy.","Hurls mud in the foe’s face to reduce its accuracy.","Hurls mud in the foe’s face to reduce its accuracy.","Hurls mud in the foe’s face to reduce its accuracy.","Hurls mud in the foe’s face to reduce its accuracy.","Hurls mud in the foe’s face to reduce its accuracy.","Hurls mud in the foe’s face to reduce its accuracy."
"Fires a lump of ink to damage and cut accuracy.","Fires a lump of ink to damage and cut accuracy.","Fires a lump of ink to damage and cut accuracy.","Fires a lump of ink to damage and cut accuracy.","Fires a lump of ink to damage and cut accuracy.","Fires a lump of ink to damage and cut accuracy.","Fires a lump of ink to damage and cut accuracy."
"Sets spikes that hurt a  foe switching out.","Sets spikes that hurt a  foe switching out.","Sets spikes that hurt a  foe switching out.","Sets spikes that hurt a  foe switching out.","Sets spikes that hurt a  foe switching out.","Sets spikes that hurt a  foe switching out.","Sets spikes that hurt a  foe switching out."
"Powerful and sure to cause paralysis, but inaccurate.","Powerful and sure to cause paralysis, but inaccurate.","Powerful and sure to cause paralysis, but inaccurate.","Powerful and sure to cause paralysis, but inaccurate.","Powerful and sure to cause paralysis, but inaccurate.","Powerful and sure to cause paralysis, but inaccurate.","Powerful and sure to cause paralysis, but inaccurate."
"Negates the foe’s efforts to heighten evasiveness.","Negates the foe’s efforts to heighten evasiveness.","Negates the foe’s efforts to heighten evasiveness.","Negates the foe’s efforts to heighten evasiveness.","Negates the foe’s efforts to heighten evasiveness.","Negates the foe’s efforts to heighten evasiveness.","Negates the foe’s efforts to heighten evasiveness."
"If the user faints, the foe is also made to faint.","If the user faints, the foe is also made to faint.","If the user faints, the foe is also made to faint.","If the user faints, the foe is also made to faint.","If the user faints, the foe is also made to faint.","If the user faints, the foe is also made to faint.","If the user faints, the foe is also made to faint."
"Any POKéMON hearing this song faints in 3 turns.","Any POKéMON hearing this song faints in 3 turns.","Any POKéMON hearing this song faints in 3 turns.","Any POKéMON hearing this song faints in 3 turns.","Any POKéMON hearing this song faints in 3 turns.","Any POKéMON hearing this song faints in 3 turns.","Any POKéMON hearing this song faints in 3 turns."
"A chilling attack that lowers the foe’s SPEED.","A chilling attack that lowers the foe’s SPEED.","A chilling attack that lowers the foe’s SPEED.","A chilling attack that lowers the foe’s SPEED.","A chilling attack that lowers the foe’s SPEED.","A chilling attack that lowers the foe’s SPEED.","A chilling attack that lowers the foe’s SPEED."
"Evades attack, but may fail if used in succession.","Evades attack, but may fail if used in succession.","Evades attack, but may fail if used in succession.","Evades attack, but may fail if used in succession.","Evades attack, but may fail if used in succession.","Evades attack, but may fail if used in succession.","Evades attack, but may fail if used in succession."
"Strikes the foe with a bone in hand 2 to 5 times.","Strikes the foe with a bone in hand 2 to 5 times.","Strikes the foe with a bone in hand 2 to 5 times.","Strikes the foe with a bone in hand 2 to 5 times.","Strikes the foe with a bone in hand 2 to 5 times.","Strikes the foe with a bone in hand 2 to 5 times.","Strikes the foe with a bone in hand 2 to 5 times."
"Locks on to the foe to ensure the next move hits.","Locks on to the foe to ensure the next move hits.","Locks on to the foe to ensure the next move hits.","Locks on to the foe to ensure the next move hits.","Locks on to the foe to ensure the next move hits.","Locks on to the foe to ensure the next move hits.","Locks on to the foe to ensure the next move hits."
"A rampage of 2 to 3 turns that confuses the user.","A rampage of 2 to 3 turns that confuses the user.","A rampage of 2 to 3 turns that confuses the user.","A rampage of 2 to 3 turns that confuses the user.","A rampage of 2 to 3 turns that confuses the user.","A rampage of 2 to 3 turns that confuses the user.","A rampage of 2 to 3 turns that confuses the user."
"Causes a sandstorm that rages for several turns.","Causes a sandstorm that rages for several turns.","Causes a sandstorm that rages for several turns.","Causes a sandstorm that rages for several turns.","Causes a sandstorm that rages for several turns.","Causes a sandstorm that rages for several turns.","Causes a sandstorm that rages for several turns."
"An attack that steals half the damage inflicted.","An attack that steals half the damage inflicted.","An attack that steals half the damage inflicted.","An attack that steals half the damage inflicted.","An attack that steals half the damage inflicted.","An attack that steals half the damage inflicted.","An attack that steals half the damage inflicted."
"Endures any attack for 1 turn, leaving at least 1HP.","Endures any attack for 1 turn, leaving at least 1HP.","Endures any attack for 1 turn, leaving at least 1HP.","Endures any attack for 1 turn, leaving at least 1HP.","Endures any attack for 1 turn, leaving at least 1HP.","Endures any attack for 1 turn, leaving at least 1HP.","Endures any attack for 1 turn, leaving at least 1HP."
"Charms the foe and sharply reduces its ATTACK.","Charms the foe and sharply reduces its ATTACK.","Charms the foe and sharply reduces its ATTACK.","Charms the foe and sharply reduces its ATTACK.","Charms the foe and sharply reduces its ATTACK.","Charms the foe and sharply reduces its ATTACK.","Charms the foe and sharply reduces its ATTACK."
"An attack lasting 5 turns with rising intensity.","An attack lasting 5 turns with rising intensity.","An attack lasting 5 turns with rising intensity.","An attack lasting 5 turns with rising intensity.","An attack lasting 5 turns with rising intensity.","An attack lasting 5 turns with rising intensity.","An attack lasting 5 turns with rising intensity."
"An attack that leaves the foe with at least 1 HP.","An attack that leaves the foe with at least 1 HP.","An attack that leaves the foe with at least 1 HP.","An attack that leaves the foe with at least 1 HP.","An attack that leaves the foe with at least 1 HP.","An attack that leaves the foe with at least 1 HP.","An attack that leaves the foe with at least 1 HP."
"Confuses the foe, but also sharply raises ATTACK.","Confuses the foe, but also sharply raises ATTACK.","Confuses the foe, but also sharply raises ATTACK.","Confuses the foe, but also sharply raises ATTACK.","Confuses the foe, but also sharply raises ATTACK.","Confuses the foe, but also sharply raises ATTACK.","Confuses the foe, but also sharply raises ATTACK."
"Recovers up to half the user’s maximum HP.","Recovers up to half the user’s maximum HP.","Recovers up to half the user’s maximum HP.","Recovers up to half the user’s maximum HP.","Recovers up to half the user’s maximum HP.","Recovers up to half the user’s maximum HP.","Recovers up to half the user’s maximum HP."
"An electrified tackle that may paralyze the foe.","An electrified tackle that may paralyze the foe.","An electrified tackle that may paralyze the foe.","An electrified tackle that may paralyze the foe.","An electrified tackle that may paralyze the foe.","An electrified tackle that may paralyze the foe.","An electrified tackle that may paralyze the foe."
"An attack that intensifies on each successive hit.","An attack that intensifies on each successive hit.","An attack that intensifies on each successive hit.","An attack that intensifies on each successive hit.","An attack that intensifies on each successive hit.","An attack that intensifies on each successive hit.","An attack that intensifies on each successive hit."
"Strikes the foe with hard wings spread wide.","Strikes the foe with hard wings spread wide.","Strikes the foe with hard wings spread wide.","Strikes the foe with hard wings spread wide.","Strikes the foe with hard wings spread wide.","Strikes the foe with hard wings spread wide.","Strikes the foe with hard wings spread wide."
"Fixes the foe with a mean look that prevents escape.","Fixes the foe with a mean look that prevents escape.","Fixes the foe with a mean look that prevents escape.","Fixes the foe with a mean look that prevents escape.","Fixes the foe with a mean look that prevents escape.","Fixes the foe with a mean look that prevents escape.","Fixes the foe with a mean look that prevents escape."
"Makes the opposite gender less likely to attack.","Makes the opposite gender less likely to attack.","Makes the opposite gender less likely to attack.","Makes the opposite gender less likely to attack.","Makes the opposite gender less likely to attack.","Makes the opposite gender less likely to attack.","Makes the opposite gender less likely to attack."
"Uses an own move randomly while asleep.","Uses an own move randomly while asleep.","Uses an own move randomly while asleep.","Uses an own move randomly while asleep.","Uses an own move randomly while asleep.","Uses an own move randomly while asleep.","Uses an own move randomly while asleep."
"Chimes soothingly to heal all status abnormalities.","Chimes soothingly to heal all status abnormalities.","Chimes soothingly to heal all status abnormalities.","Chimes soothingly to heal all status abnormalities.","Chimes soothingly to heal all status abnormalities.","Chimes soothingly to heal all status abnormalities.","Chimes soothingly to heal all status abnormalities."
"An attack that increases in power with friendship.","An attack that increases in power with friendship.","An attack that increases in power with friendship.","An attack that increases in power with friendship.","An attack that increases in power with friendship.","An attack that increases in power with friendship.","An attack that increases in power with friendship."
"A gift in the form of a bomb. May restore HP.","A gift in the form of a bomb. May restore HP.","A gift in the form of a bomb. May restore HP.","A gift in the form of a bomb. May restore HP.","A gift in the form of a bomb. May restore HP.","A gift in the form of a bomb. May restore HP.","A gift in the form of a bomb. May restore HP."
