en,fr,it,de,es,ko,kana
"Absorbs light in one turn, then attacks next turn.","Absorbs light in one turn, then attacks next turn.","Absorbs light in one turn, then attacks next turn.","Absorbs light in one turn, then attacks next turn.","Absorbs light in one turn, then attacks next turn.","Absorbs light in one turn, then attacks next turn.","Absorbs light in one turn, then attacks next turn."
"Scatters a toxic powder that may poison the foe.","Scatters a toxic powder that may poison the foe.","Scatters a toxic powder that may poison the foe.","Scatters a toxic powder that may poison the foe.","Scatters a toxic powder that may poison the foe.","Scatters a toxic powder that may poison the foe.","Scatters a toxic powder that may poison the foe."
"Scatters a powder that may paralyze the foe.","Scatters a powder that may paralyze the foe.","Scatters a powder that may paralyze the foe.","Scatters a powder that may paralyze the foe.","Scatters a powder that may paralyze the foe.","Scatters a powder that may paralyze the foe.","Scatters a powder that may paralyze the foe."
"Scatters a powder that may cause the foe to sleep.","Scatters a powder that may cause the foe to sleep.","Scatters a powder that may cause the foe to sleep.","Scatters a powder that may cause the foe to sleep.","Scatters a powder that may cause the foe to sleep.","Scatters a powder that may cause the foe to sleep.","Scatters a powder that may cause the foe to sleep."
"A rampage of 2 to 3 turns that confuses the user.","A rampage of 2 to 3 turns that confuses the user.","A rampage of 2 to 3 turns that confuses the user.","A rampage of 2 to 3 turns that confuses the user.","A rampage of 2 to 3 turns that confuses the user.","A rampage of 2 to 3 turns that confuses the user.","A rampage of 2 to 3 turns that confuses the user."
"Binds the foe with string to reduce its SPEED.","Binds the foe with string to reduce its SPEED.","Binds the foe with string to reduce its SPEED.","Binds the foe with string to reduce its SPEED.","Binds the foe with string to reduce its SPEED.","Binds the foe with string to reduce its SPEED.","Binds the foe with string to reduce its SPEED."
"Launches shock waves that always inflict 40 HP damage.","Launches shock waves that always inflict 40 HP damage.","Launches shock waves that always inflict 40 HP damage.","Launches shock waves that always inflict 40 HP damage.","Launches shock waves that always inflict 40 HP damage.","Launches shock waves that always inflict 40 HP damage.","Launches shock waves that always inflict 40 HP damage."
"Traps the foe in a ring of fire for 2 to 5 turns.","Traps the foe in a ring of fire for 2 to 5 turns.","Traps the foe in a ring of fire for 2 to 5 turns.","Traps the foe in a ring of fire for 2 to 5 turns.","Traps the foe in a ring of fire for 2 to 5 turns.","Traps the foe in a ring of fire for 2 to 5 turns.","Traps the foe in a ring of fire for 2 to 5 turns."
"An electrical attack that may paralyze the foe.","An electrical attack that may paralyze the foe.","An electrical attack that may paralyze the foe.","An electrical attack that may paralyze the foe.","An electrical attack that may paralyze the foe.","An electrical attack that may paralyze the foe.","An electrical attack that may paralyze the foe."
"A strong electrical attack that may paralyze the foe.","A strong electrical attack that may paralyze the foe.","A strong electrical attack that may paralyze the foe.","A strong electrical attack that may paralyze the foe.","A strong electrical attack that may paralyze the foe.","A strong electrical attack that may paralyze the foe.","A strong electrical attack that may paralyze the foe."
"A weak jolt of electricity that paralyzes the foe.","A weak jolt of electricity that paralyzes the foe.","A weak jolt of electricity that paralyzes the foe.","A weak jolt of electricity that paralyzes the foe.","A weak jolt of electricity that paralyzes the foe.","A weak jolt of electricity that paralyzes the foe.","A weak jolt of electricity that paralyzes the foe."
"A lightning attack that may cause paralysis.","A lightning attack that may cause paralysis.","A lightning attack that may cause paralysis.","A lightning attack that may cause paralysis.","A lightning attack that may cause paralysis.","A lightning attack that may cause paralysis.","A lightning attack that may cause paralysis."
"Throws small rocks to strike the foe.","Throws small rocks to strike the foe.","Throws small rocks to strike the foe.","Throws small rocks to strike the foe.","Throws small rocks to strike the foe.","Throws small rocks to strike the foe.","Throws small rocks to strike the foe."
"A powerful quake, but has no effect on flying foes.","A powerful quake, but has no effect on flying foes.","A powerful quake, but has no effect on flying foes.","A powerful quake, but has no effect on flying foes.","A powerful quake, but has no effect on flying foes.","A powerful quake, but has no effect on flying foes.","A powerful quake, but has no effect on flying foes."
"A one-hit KO move that drops the foe in a fissure.","A one-hit KO move that drops the foe in a fissure.","A one-hit KO move that drops the foe in a fissure.","A one-hit KO move that drops the foe in a fissure.","A one-hit KO move that drops the foe in a fissure.","A one-hit KO move that drops the foe in a fissure.","A one-hit KO move that drops the foe in a fissure."
"Digs underground the first turn and strikes next turn.","Digs underground the first turn and strikes next turn.","Digs underground the first turn and strikes next turn.","Digs underground the first turn and strikes next turn.","Digs underground the first turn and strikes next turn.","Digs underground the first turn and strikes next turn.","Digs underground the first turn and strikes next turn."
"Poisons the foe with an intensifying toxin.","Poisons the foe with an intensifying toxin.","Poisons the foe with an intensifying toxin.","Poisons the foe with an intensifying toxin.","Poisons the foe with an intensifying toxin.","Poisons the foe with an intensifying toxin.","Poisons the foe with an intensifying toxin."
"A psychic attack that may cause confusion.","A psychic attack that may cause confusion.","A psychic attack that may cause confusion.","A psychic attack that may cause confusion.","A psychic attack that may cause confusion.","A psychic attack that may cause confusion.","A psychic attack that may cause confusion."
"A powerful psychic attack that may lower SP. DEF.","A powerful psychic attack that may lower SP. DEF.","A powerful psychic attack that may lower SP. DEF.","A powerful psychic attack that may lower SP. DEF.","A powerful psychic attack that may lower SP. DEF.","A powerful psychic attack that may lower SP. DEF.","A powerful psychic attack that may lower SP. DEF."
"A hypnotizing move that may induce sleep.","A hypnotizing move that may induce sleep.","A hypnotizing move that may induce sleep.","A hypnotizing move that may induce sleep.","A hypnotizing move that may induce sleep.","A hypnotizing move that may induce sleep.","A hypnotizing move that may induce sleep."
"Meditates in a peaceful fashion to raise ATTACK.","Meditates in a peaceful fashion to raise ATTACK.","Meditates in a peaceful fashion to raise ATTACK.","Meditates in a peaceful fashion to raise ATTACK.","Meditates in a peaceful fashion to raise ATTACK.","Meditates in a peaceful fashion to raise ATTACK.","Meditates in a peaceful fashion to raise ATTACK."
"Relaxes the body to sharply boost SPEED.","Relaxes the body to sharply boost SPEED.","Relaxes the body to sharply boost SPEED.","Relaxes the body to sharply boost SPEED.","Relaxes the body to sharply boost SPEED.","Relaxes the body to sharply boost SPEED.","Relaxes the body to sharply boost SPEED."
"An extremely fast attack that always strikes first.","An extremely fast attack that always strikes first.","An extremely fast attack that always strikes first.","An extremely fast attack that always strikes first.","An extremely fast attack that always strikes first.","An extremely fast attack that always strikes first.","An extremely fast attack that always strikes first."
"Raises the user’s ATTACK every time it is hit.","Raises the user’s ATTACK every time it is hit.","Raises the user’s ATTACK every time it is hit.","Raises the user’s ATTACK every time it is hit.","Raises the user’s ATTACK every time it is hit.","Raises the user’s ATTACK every time it is hit.","Raises the user’s ATTACK every time it is hit."
"A psychic move for fleeing from battle instantly.","A psychic move for fleeing from battle instantly.","A psychic move for fleeing from battle instantly.","A psychic move for fleeing from battle instantly.","A psychic move for fleeing from battle instantly.","A psychic move for fleeing from battle instantly.","A psychic move for fleeing from battle instantly."
"Inflicts damage identical to the user’s level.","Inflicts damage identical to the user’s level.","Inflicts damage identical to the user’s level.","Inflicts damage identical to the user’s level.","Inflicts damage identical to the user’s level.","Inflicts damage identical to the user’s level.","Inflicts damage identical to the user’s level."
"Copies a move used by the foe during one battle.","Copies a move used by the foe during one battle.","Copies a move used by the foe during one battle.","Copies a move used by the foe during one battle.","Copies a move used by the foe during one battle.","Copies a move used by the foe during one battle.","Copies a move used by the foe during one battle."
"Emits a screech to sharply reduce the foe’s DEFENSE.","Emits a screech to sharply reduce the foe’s DEFENSE.","Emits a screech to sharply reduce the foe’s DEFENSE.","Emits a screech to sharply reduce the foe’s DEFENSE.","Emits a screech to sharply reduce the foe’s DEFENSE.","Emits a screech to sharply reduce the foe’s DEFENSE.","Emits a screech to sharply reduce the foe’s DEFENSE."
"Creates illusory copies to raise evasiveness.","Creates illusory copies to raise evasiveness.","Creates illusory copies to raise evasiveness.","Creates illusory copies to raise evasiveness.","Creates illusory copies to raise evasiveness.","Creates illusory copies to raise evasiveness.","Creates illusory copies to raise evasiveness."
"Recovers up to half the user’s maximum HP.","Recovers up to half the user’s maximum HP.","Recovers up to half the user’s maximum HP.","Recovers up to half the user’s maximum HP.","Recovers up to half the user’s maximum HP.","Recovers up to half the user’s maximum HP.","Recovers up to half the user’s maximum HP."
"Stiffens the body’s  muscles to raise DEFENSE.","Stiffens the body’s  muscles to raise DEFENSE.","Stiffens the body’s  muscles to raise DEFENSE.","Stiffens the body’s  muscles to raise DEFENSE.","Stiffens the body’s  muscles to raise DEFENSE.","Stiffens the body’s  muscles to raise DEFENSE.","Stiffens the body’s  muscles to raise DEFENSE."
"Minimizes the user’s size to raise evasiveness.","Minimizes the user’s size to raise evasiveness.","Minimizes the user’s size to raise evasiveness.","Minimizes the user’s size to raise evasiveness.","Minimizes the user’s size to raise evasiveness.","Minimizes the user’s size to raise evasiveness.","Minimizes the user’s size to raise evasiveness."
"Lowers the foe’s accuracy using smoke, ink, etc.","Lowers the foe’s accuracy using smoke, ink, etc.","Lowers the foe’s accuracy using smoke, ink, etc.","Lowers the foe’s accuracy using smoke, ink, etc.","Lowers the foe’s accuracy using smoke, ink, etc.","Lowers the foe’s accuracy using smoke, ink, etc.","Lowers the foe’s accuracy using smoke, ink, etc."
"A sinister ray that confuses the foe.","A sinister ray that confuses the foe.","A sinister ray that confuses the foe.","A sinister ray that confuses the foe.","A sinister ray that confuses the foe.","A sinister ray that confuses the foe.","A sinister ray that confuses the foe."
"Withdraws the body into its hard shell to raise DEFENSE.","Withdraws the body into its hard shell to raise DEFENSE.","Withdraws the body into its hard shell to raise DEFENSE.","Withdraws the body into its hard shell to raise DEFENSE.","Withdraws the body into its hard shell to raise DEFENSE.","Withdraws the body into its hard shell to raise DEFENSE.","Withdraws the body into its hard shell to raise DEFENSE."
"Curls up to conceal weak spots and raise DEFENSE.","Curls up to conceal weak spots and raise DEFENSE.","Curls up to conceal weak spots and raise DEFENSE.","Curls up to conceal weak spots and raise DEFENSE.","Curls up to conceal weak spots and raise DEFENSE.","Curls up to conceal weak spots and raise DEFENSE.","Curls up to conceal weak spots and raise DEFENSE."
"Creates a barrier that sharply raises DEFENSE.","Creates a barrier that sharply raises DEFENSE.","Creates a barrier that sharply raises DEFENSE.","Creates a barrier that sharply raises DEFENSE.","Creates a barrier that sharply raises DEFENSE.","Creates a barrier that sharply raises DEFENSE.","Creates a barrier that sharply raises DEFENSE."
"Creates a wall of light that lowers SP. ATK damage.","Creates a wall of light that lowers SP. ATK damage.","Creates a wall of light that lowers SP. ATK damage.","Creates a wall of light that lowers SP. ATK damage.","Creates a wall of light that lowers SP. ATK damage.","Creates a wall of light that lowers SP. ATK damage.","Creates a wall of light that lowers SP. ATK damage."
"Creates a black haze that eliminates all stat changes.","Creates a black haze that eliminates all stat changes.","Creates a black haze that eliminates all stat changes.","Creates a black haze that eliminates all stat changes.","Creates a black haze that eliminates all stat changes.","Creates a black haze that eliminates all stat changes.","Creates a black haze that eliminates all stat changes."
"Creates a wall of light that weakens physical attacks.","Creates a wall of light that weakens physical attacks.","Creates a wall of light that weakens physical attacks.","Creates a wall of light that weakens physical attacks.","Creates a wall of light that weakens physical attacks.","Creates a wall of light that weakens physical attacks.","Creates a wall of light that weakens physical attacks."
"Focuses power to raise the critical-hit ratio.","Focuses power to raise the critical-hit ratio.","Focuses power to raise the critical-hit ratio.","Focuses power to raise the critical-hit ratio.","Focuses power to raise the critical-hit ratio.","Focuses power to raise the critical-hit ratio.","Focuses power to raise the critical-hit ratio."
"Endures attack for 2 turns to retaliate double.","Endures attack for 2 turns to retaliate double.","Endures attack for 2 turns to retaliate double.","Endures attack for 2 turns to retaliate double.","Endures attack for 2 turns to retaliate double.","Endures attack for 2 turns to retaliate double.","Endures attack for 2 turns to retaliate double."
"Waggles a finger to use any POKéMON move at random.","Waggles a finger to use any POKéMON move at random.","Waggles a finger to use any POKéMON move at random.","Waggles a finger to use any POKéMON move at random.","Waggles a finger to use any POKéMON move at random.","Waggles a finger to use any POKéMON move at random.","Waggles a finger to use any POKéMON move at random."
"Counters the foe’s attack with the same move.","Counters the foe’s attack with the same move.","Counters the foe’s attack with the same move.","Counters the foe’s attack with the same move.","Counters the foe’s attack with the same move.","Counters the foe’s attack with the same move.","Counters the foe’s attack with the same move."
"Inflicts severe damage but makes the user faint.","Inflicts severe damage but makes the user faint.","Inflicts severe damage but makes the user faint.","Inflicts severe damage but makes the user faint.","Inflicts severe damage but makes the user faint.","Inflicts severe damage but makes the user faint.","Inflicts severe damage but makes the user faint."
"An egg is forcibly hurled at the foe.","An egg is forcibly hurled at the foe.","An egg is forcibly hurled at the foe.","An egg is forcibly hurled at the foe.","An egg is forcibly hurled at the foe.","An egg is forcibly hurled at the foe.","An egg is forcibly hurled at the foe."
"Licks with a long tongue to injure. May also paralyze.","Licks with a long tongue to injure. May also paralyze.","Licks with a long tongue to injure. May also paralyze.","Licks with a long tongue to injure. May also paralyze.","Licks with a long tongue to injure. May also paralyze.","Licks with a long tongue to injure. May also paralyze.","Licks with a long tongue to injure. May also paralyze."
"An exhaust-gas attack that may also poison.","An exhaust-gas attack that may also poison.","An exhaust-gas attack that may also poison.","An exhaust-gas attack that may also poison.","An exhaust-gas attack that may also poison.","An exhaust-gas attack that may also poison.","An exhaust-gas attack that may also poison."
"Sludge is hurled to inflict damage. May also poison.","Sludge is hurled to inflict damage. May also poison.","Sludge is hurled to inflict damage. May also poison.","Sludge is hurled to inflict damage. May also poison.","Sludge is hurled to inflict damage. May also poison.","Sludge is hurled to inflict damage. May also poison.","Sludge is hurled to inflict damage. May also poison."
"Clubs the foe with a bone. May cause flinching.","Clubs the foe with a bone. May cause flinching.","Clubs the foe with a bone. May cause flinching.","Clubs the foe with a bone. May cause flinching.","Clubs the foe with a bone. May cause flinching.","Clubs the foe with a bone. May cause flinching.","Clubs the foe with a bone. May cause flinching."
"A fiery blast that scorches all. May cause a burn.","A fiery blast that scorches all. May cause a burn.","A fiery blast that scorches all. May cause a burn.","A fiery blast that scorches all. May cause a burn.","A fiery blast that scorches all. May cause a burn.","A fiery blast that scorches all. May cause a burn.","A fiery blast that scorches all. May cause a burn."
"Charges the foe with speed to climb waterfalls.","Charges the foe with speed to climb waterfalls.","Charges the foe with speed to climb waterfalls.","Charges the foe with speed to climb waterfalls.","Charges the foe with speed to climb waterfalls.","Charges the foe with speed to climb waterfalls.","Charges the foe with speed to climb waterfalls."
"Traps and squeezes the foe for 2 to 5 turns.","Traps and squeezes the foe for 2 to 5 turns.","Traps and squeezes the foe for 2 to 5 turns.","Traps and squeezes the foe for 2 to 5 turns.","Traps and squeezes the foe for 2 to 5 turns.","Traps and squeezes the foe for 2 to 5 turns.","Traps and squeezes the foe for 2 to 5 turns."
"Sprays star-shaped rays that never miss.","Sprays star-shaped rays that never miss.","Sprays star-shaped rays that never miss.","Sprays star-shaped rays that never miss.","Sprays star-shaped rays that never miss.","Sprays star-shaped rays that never miss.","Sprays star-shaped rays that never miss."
"Tucks in the head, then attacks on the next turn.","Tucks in the head, then attacks on the next turn.","Tucks in the head, then attacks on the next turn.","Tucks in the head, then attacks on the next turn.","Tucks in the head, then attacks on the next turn.","Tucks in the head, then attacks on the next turn.","Tucks in the head, then attacks on the next turn."
"Launches sharp spikes that strike 2 to 5 times.","Launches sharp spikes that strike 2 to 5 times.","Launches sharp spikes that strike 2 to 5 times.","Launches sharp spikes that strike 2 to 5 times.","Launches sharp spikes that strike 2 to 5 times.","Launches sharp spikes that strike 2 to 5 times.","Launches sharp spikes that strike 2 to 5 times."
"Constricts to inflict pain. May lower SPEED.","Constricts to inflict pain. May lower SPEED.","Constricts to inflict pain. May lower SPEED.","Constricts to inflict pain. May lower SPEED.","Constricts to inflict pain. May lower SPEED.","Constricts to inflict pain. May lower SPEED.","Constricts to inflict pain. May lower SPEED."
"Forgets about something and sharply raises SP. DEF.","Forgets about something and sharply raises SP. DEF.","Forgets about something and sharply raises SP. DEF.","Forgets about something and sharply raises SP. DEF.","Forgets about something and sharply raises SP. DEF.","Forgets about something and sharply raises SP. DEF.","Forgets about something and sharply raises SP. DEF."
"Distracts the foe. May lower accuracy.","Distracts the foe. May lower accuracy.","Distracts the foe. May lower accuracy.","Distracts the foe. May lower accuracy.","Distracts the foe. May lower accuracy.","Distracts the foe. May lower accuracy.","Distracts the foe. May lower accuracy."
"Recovers up to half the user’s maximum HP.","Recovers up to half the user’s maximum HP.","Recovers up to half the user’s maximum HP.","Recovers up to half the user’s maximum HP.","Recovers up to half the user’s maximum HP.","Recovers up to half the user’s maximum HP.","Recovers up to half the user’s maximum HP."
"A jumping knee kick. If it misses, the user is hurt.","A jumping knee kick. If it misses, the user is hurt.","A jumping knee kick. If it misses, the user is hurt.","A jumping knee kick. If it misses, the user is hurt.","A jumping knee kick. If it misses, the user is hurt.","A jumping knee kick. If it misses, the user is hurt.","A jumping knee kick. If it misses, the user is hurt."
"Intimidates and frightens the foe into paralysis.","Intimidates and frightens the foe into paralysis.","Intimidates and frightens the foe into paralysis.","Intimidates and frightens the foe into paralysis.","Intimidates and frightens the foe into paralysis.","Intimidates and frightens the foe into paralysis.","Intimidates and frightens the foe into paralysis."
"Takes one half the damage inflicted on a sleeping foe.","Takes one half the damage inflicted on a sleeping foe.","Takes one half the damage inflicted on a sleeping foe.","Takes one half the damage inflicted on a sleeping foe.","Takes one half the damage inflicted on a sleeping foe.","Takes one half the damage inflicted on a sleeping foe.","Takes one half the damage inflicted on a sleeping foe."
"Envelops the foe in a toxic gas that may poison.","Envelops the foe in a toxic gas that may poison.","Envelops the foe in a toxic gas that may poison.","Envelops the foe in a toxic gas that may poison.","Envelops the foe in a toxic gas that may poison.","Envelops the foe in a toxic gas that may poison.","Envelops the foe in a toxic gas that may poison."
"Hurls round objects at the foe 2 to 5 times.","Hurls round objects at the foe 2 to 5 times.","Hurls round objects at the foe 2 to 5 times.","Hurls round objects at the foe 2 to 5 times.","Hurls round objects at the foe 2 to 5 times.","Hurls round objects at the foe 2 to 5 times.","Hurls round objects at the foe 2 to 5 times."
"An attack that steals half the damage inflicted.","An attack that steals half the damage inflicted.","An attack that steals half the damage inflicted.","An attack that steals half the damage inflicted.","An attack that steals half the damage inflicted.","An attack that steals half the damage inflicted.","An attack that steals half the damage inflicted."
"Demands a kiss with a scary face that induces sleep.","Demands a kiss with a scary face that induces sleep.","Demands a kiss with a scary face that induces sleep.","Demands a kiss with a scary face that induces sleep.","Demands a kiss with a scary face that induces sleep.","Demands a kiss with a scary face that induces sleep.","Demands a kiss with a scary face that induces sleep."
"Searches out weak spots, then strikes the next turn.","Searches out weak spots, then strikes the next turn.","Searches out weak spots, then strikes the next turn.","Searches out weak spots, then strikes the next turn.","Searches out weak spots, then strikes the next turn.","Searches out weak spots, then strikes the next turn.","Searches out weak spots, then strikes the next turn."
"Alters the user’s cells to become a copy of the foe.","Alters the user’s cells to become a copy of the foe.","Alters the user’s cells to become a copy of the foe.","Alters the user’s cells to become a copy of the foe.","Alters the user’s cells to become a copy of the foe.","Alters the user’s cells to become a copy of the foe.","Alters the user’s cells to become a copy of the foe."
"An attack using bubbles. May lower the foe’s SPEED.","An attack using bubbles. May lower the foe’s SPEED.","An attack using bubbles. May lower the foe’s SPEED.","An attack using bubbles. May lower the foe’s SPEED.","An attack using bubbles. May lower the foe’s SPEED.","An attack using bubbles. May lower the foe’s SPEED.","An attack using bubbles. May lower the foe’s SPEED."
"A rhythmic punch that may confuse the foe.","A rhythmic punch that may confuse the foe.","A rhythmic punch that may confuse the foe.","A rhythmic punch that may confuse the foe.","A rhythmic punch that may confuse the foe.","A rhythmic punch that may confuse the foe.","A rhythmic punch that may confuse the foe."
"Scatters a cloud of spores that always induce sleep.","Scatters a cloud of spores that always induce sleep.","Scatters a cloud of spores that always induce sleep.","Scatters a cloud of spores that always induce sleep.","Scatters a cloud of spores that always induce sleep.","Scatters a cloud of spores that always induce sleep.","Scatters a cloud of spores that always induce sleep."
